{"authority":"local-static-manifest-request-only","namespace":"static-preparation","nic":{"external_launch_template":{"id":"lt-0123456789abcdef0","operator_review":{"cpu_options":{"core_count":1,"nested_virtualization":"enabled","threads_per_core":2}},"version":7},"node_group_name":"cogs-stage4-sandbox-kata"},"release_name":"stage4","values":{"auditWalMaxBytes":1048576,"enabled":true,"images":{"proxy":"docker.io/envoyproxy/envoy:distroless-v1.38.4@sha256:b28fbee81528c5b6e8857412e5e0f48ea5baa0199cf73ab611aa7f88a808eba7","sandbox":"registry.example.invalid/cogs/sandbox@sha256:cccccccccccccccccccccccccccccccccccccccccccccccccccccccccccccccc","worker":"registry.example.invalid/cogs/worker@sha256:aaaaaaaaaaaaaaaaaaaaaaaaaaaaaaaaaaaaaaaaaaaaaaaaaaaaaaaaaaaaaaaa"},"lifecycle":{"hardSeconds":28800,"idleSeconds":1800,"terminationGraceSeconds":30},"nonProductionAcknowledgement":true,"openBao":{"endpoint":"https://openbao.static-test.invalid:8200","kubernetesAuthMount":"auth/cogs-static-test","kubernetesAuthRole":"cogs-static-test-role","peer":{"namespaceLabels":{"kubernetes.io/metadata.name":"synthetic-openbao"},"podLabels":{"app.kubernetes.io/name":"synthetic-openbao"},"port":8200},"pkiPath":"pki/cogs-static-test","tokenAudience":"openbao.cogs.static-test"},"otlp":{"endpoint":"https://otlp.static-test.invalid:4317","peer":{"namespaceLabels":{"kubernetes.io/metadata.name":"synthetic-observability"},"podLabels":{"app.kubernetes.io/name":"synthetic-otel-collector"},"port":4317},"protocol":"grpc"},"placement":{"sandbox":{"nodeSelector":{"cogs.dev/nested-virtualization":"enabled","cogs.dev/node-domain":"sandbox-kata","cogs.dev/sandbox-runtime":"kata-qemu-kvm"},"tolerations":[{"effect":"NoSchedule","key":"cogs.dev/sandbox","operator":"Equal","value":"kata"}]},"trusted":{"nodeSelector":{"cogs.dev/node-domain":"trusted"},"tolerations":[]}},"proxyIdentity":{"capabilityAudience":"cogs-egress-proxy.static-test","sourceBindingRequired":true},"publicEgressCaConfigMap":"synthetic-public-egress-ca","resourceProfile":"stage4-fixed-bounded-v1","runtimeClassName":"kata-qemu-cogs","sessionIdentity":"static-test-session","storage":{"sessionStateAccessMode":"ReadWriteOncePod","sessionStateReclaimPolicy":"Retain","sessionStateRetention":"retain-30-days-after-session-close","sessionStateRetentionSeconds":2592000,"sessionStateSize":"5Gi","sessionStateStorageClass":"synthetic-session-state-csi","sessionStateVolumeBindingMode":"WaitForFirstConsumer","sessionStateVolumeMode":"Filesystem","workspaceAccessMode":"ReadWriteOncePod","workspaceReclaimPolicy":"Retain","workspaceRetention":"retain-until-explicit-workspace-deletion","workspaceSize":"20Gi","workspaceStorageClass":"synthetic-workspace-csi","workspaceVolumeBindingMode":"WaitForFirstConsumer","workspaceVolumeMode":"Filesystem"}},"version":"cogs.stage4-static-manifest-request/v1"}
